{"schema_version":"1.0","model_release_id":"modelrel_019abc","brand_model":"novagrid-chat-7b-v1","engine":"llama.cpp","engine_version":"b6000","context_tokens":8192,"minimum_vram_bytes":12884901888,"artifacts":[{"platform":"windows","architecture":"amd64","url":"https://artifacts.invalid/models/model.gguf","sha256":"aaaaaaaaaaaaaaaaaaaaaaaaaaaaaaaaaaaaaaaaaaaaaaaaaaaaaaaaaaaaaaaa","size_bytes":5000000000}],"created_at":"2026-08-14T08:00:00Z"}
